SI_COV_SOCHHLP,Number of social protection beneficiaries receiving in-home care,Broj korisnika socijalne zaštite koji ostvaruju pravo na pomoć u kući,Број корисника социјалне заштите који остварују право на помоћ у кући,6,1
SI_COV_SOCHRP,Number of social protection beneficiaries placed in a foster family,Broj korisnika socijalne zaštite koji ostvaruju pravo na zbrinjavanje u hraniteljsku porodicu,Број корисника социјалне заштите који остварују право на збрињавање у хранитељску породицу,6,1
SI_COV_SOCNP,Number of social protection beneficiaries receiving financial aid,Broj korisnika socijalne zaštite koji ostvaruju pravo na novčanu pomoć,Број корисника социјалне заштите који остварују право на новчану помоћ,3,1
SI_COV_SOCOTFA,Number of social protection beneficiaries receiving one-time financial aid,Broj korisnika socijalne zaštite koji ostvaruju pravo na jednokratnu novčanu pomoć,Број корисника социјалне заштите који остварују право на једнократну новчану помоћ,6,1
SI_COV_SOCPDPENS,Number of social protection beneficiaries receiving personal disability payment,Broj korisnika socijalne zaštite koji ostvaruju pravo na ličnu invalidninu,Број корисника социјалне заштите који остварују право на личну инвалиднину,6,1
SI_COV_SOCSRAZ,Number of social protection beneficiaries receiving support in the equalization of opportunities for disabled children and youth,Broj korisnika socijalne zaštite koji ostvaruju pravo na podršku u izjednačavanju djece i omladine sa smetnjama u razvoju,Број корисника социјалне заштите који остварују право на подршку у изједначавању дјеце и омладине са сметњама у развоју,6,1
SI_COV_SOCSUST,Number of social protection beneficiaries placed in a social protection institution or in another institution,Broj korisnika socijalne zaštite koji ostvaruju pravo na smještaj u ustanovu socijalne zaštite i drugu ustanovu,Број корисника социјалне заштите који остварују право на смјештај у установу социјалне заштите и другу установу,6,1
SI_COV_SOCUSALL,Proportion of the population covered by social protection systems,Udio korisnika socijalne zaštite u ukupnoj populaciji,Удио корисника социјалне заштите у укупној популацији,2,1
SI_COV_SOCUSSA,Number of social protection beneficiaries by sex and age,Broj korisnika socijalne zaštite po polu i starosti,Број корисника социјалне заштите по полу и старости,6,1
SI_POV_50MEHH,SI_POV_50MEHH,SI_POV_50MEHH,SI_POV_50MEHH,1,1
SI_POV_HHD,Proportion of households living below the national poverty line,Udio domaćinstava koja žive ispod nacionalne linije siromaštva,Удио домаћинстава која живе испод националне границе сиромаштва,2,1
SI_POV_HHDA,Poverty headcount by age of household head,Veličina siromaštva po po godinama starosti nosioca domaćinstva,Величина сиромаштва по по годинама старости носиоца домаћинства,5,1
SI_POV_HHDS,Poverty headcount by sex of household head,Veličina siromaštva po polu nosioca domaćinstva,Величина сиромаштва по полу носиоца домаћинства,2,1
SI_POV_NAHC,Proportion of population living below the national poverty line,Udio stanovništva koje živi ispod nacionalne granice siromaštva,Удио становништва које живи испод националне границе сиромаштва,2,1
SL_TLF_UEM,Unemployment rate,Stopa nezaposlenosti,Стопа незапослености,18,1
SN_STA_OVWGT,Proportion of children moderately or severely overweight,Udio djece sa umjerenom ili ozbiljnom prekomjernom tjelesnom težinom,Удио дјеце са умјереном или озбиљном прекомјерном тјелесном тежином,1,1
SP_DYN_ADKL,"Adolescent birth rate (per 1,000 women in the age group)",Stopa rađanja kod adolescenata (na 1 000 žena iz starosne grupe),Стопа рађања код адолесцената (на 1 000 жена из старосне групе),2,1
SP_LGL_LNDDOC_COHFR,"Co-owners of real estate – land and buildings, ½ ownership ratio",Suvlasnici/ce u omjeru ½ nepokretnosti – zemljišta i objekata,Сувласници/це у омјеру ½ непокретности – земљишта и објеката,3,1
SP_LGL_LNDDOC_COUHFR,"Co-owners of real estate – land and buildings, ownership ratio under ½",Suvlasnici/ce u omjeru manjem od ½ nepokretnosti – zemljišta i objekata,Сувласници/це у омјеру мањем од ½ непокретности – земљишта и објеката,3,1
SP_LGL_LNDDOC_SOLO,Sole owners of real estate – land and buildings,Samostalni vlasnici/ce nepokretnosti – zemljišta i objekata,Самостални власници/це непокретности – земљишта и објеката,3,1
ST_GDP_ZS,"GDP of the section Accommodation and food service activities as a proportion of total GDP, current prices,","Učešće područja „Djelatnost pružanja smještaja, pripreme i posluživanja hrane; hotelijerstvo i ugostiteljstvo” u ukupnom BDP-u, tekuće cijene","Учешће подручја „Дјелатност пружања смјештаја, припреме и послуживања хране; хотелијерство и угоститељство” у укупном БДП-у, текуће цијене",1,1
ST_TUR_EMP,Number of employed persons in tourism,Broj zaposlenih u turizmu,Број запослених у туризму,3,1
TX_EXP_ECG,Exports from Republika Srpska by economic groupings of countries,Izvoz iz Republike Srpske po ekonomskim grupacijama zemalja,Извоз из Републике Српске по економским групацијама земаља,6,1
TX_IMP_ECG,Imports to Republika Srpska by economic groupings of countries,Uvoz u Republiku Srpsku po ekonomskim grupacijama zemalja,Увоз у Републику Српску по економским групацијама земаља,6,1
VC_HTF_DETCA,Number of trafficking offences,Broj krivičnih djela trgovine ljudima,Број кривичних дјела трговине људима,4,1
VC_HTF_DETV,Number of victims of human trafficking by sex and form of exploitation,Broj žrtava krivičnih djela trgovine ljudima prema polu i obliku eksploatacije,Број жртава кривичних дјела трговине људима према полу и облику експлоатације,7,1
VC_HTF_DETVR,"Number of victims of human trafficking per 100,000 population",Broj žrtava trgovine ljudima na 100 000 stanovnika,Број жртава трговине људима на 100 000 становника,1,1
VC_IHR_PSRC,"Number of victims of intentional homicide per 100,000 population",Broj žrtava ubistava s namjerom na 100 000 stanovnika,Број жртава убистава с намјером на 100.000 становника,1,1
VC_IHR_PSRCN,Number of victims of intentional homicide,Broj žrtava ubistava s namjerom,Број жртава убистава с намјером,3,1
VC_VAW_MARR12M,"Proportion of women aged 18–74 years subjected to some form of violence by a current or former intimate partner, in the previous 12 months (%)","Udio žena starosti 18–74 godine koje su doživjele neki od oblika nasilja od strane sadašnjeg ili bivšeg partnera, u proteklih 12 mjeseci (%)","Удио жена старости 18–74 године које су доживјеле неки од облика насиља од стране садашњег или бившег партнера, у протеклих 12 мјесеци (%)",3,1
VC_VAW_MARRY15,"Proportion of women aged 18–74 years subjected to some form of violence by a current or former intimate partner, from the age of 15 (%)","Udio žena starosti 18–74 godine koje su doživjele neki od oblika nasilja od strane sadašnjeg ili bivšeg partnera, od 15. godine života (%)","Удио жена старости 18–74 године које су доживјеле неки од облика насиља од стране садашњег или бившег партнера, од 15. године живота (%)",3,1
VC_VAW_NMARR12M,"Proportion of women aged 18–74 years subjected to physical and sexual violence by persons other than an intimate partner, in the previous 12 months (%)","Udio žena starosti 18–74 godine koje su bile izložene fizičkom i seksualnom nasilju od strane osoba koje nisu njihov bliski partner, u proteklih 12 mjeseci (%)","Удио жена старости 18–74 године које су биле изложене физичком и сексуалном насиљу од стране особа које нису њихов блиски партнер, у протеклих 12 мјесеци (%)",2,1
VC_VAW_NMARRY15,"Proportion of women aged 18–74 years subjected to physical and sexual violence by persons other than an intimate partner, from the age of 15 (%)","Udio žena starosti 18–74 godine koje su bile izložene fizičkom i seksualnom nasilju od strane osoba koje nisu njihov bliski partner, od 15. godine života (%)","Удио жена старости 18–74 године које су биле изложене физичком и сексуалном насиљу од стране особа које нису њихов блиски партнер, од 15. године живота (%)",2,1
