Value,en,lat,cir,Disaggregation combinations using this value,Number of indicators
DC_ODA_BDPE,Public expenditure on conservation and sustainable use of biodiversity and ecosystems,Javni rashodi za očuvanje i održivo korišćenje biodiverziteta i ekosistema,Јавни расходи за очување и одрживо коришћење биодиверзитета и екосистема,1,1
DC_TRF_TOTLDIS,Total foreign direct investment stocks as on 31 Dec,Ukupno stanje direktnih stranih ulaganja na dan 31.12.,Укупно стање директних страних улагања на дан 31.12.,1,1
DC_TRF_TOTLFDI,Total foreign direct investment flows,Ukupni tokovi direktnih stranih ulaganja,Укупни токови директних страних улагања,1,1
DI_SUSP_TRS,Value of suspicious transactions for money laundering and terrorist financing - banks of Republika Srpska,Vrijednost sumnjivih transakcija na pranje novca i finansiranje terorističkih aktivnosti - banke Republike Srpske,Вриједност сумњивих трансакција на прање новца и финансирање терористичких активности - банке Републике Српске,2,1
EG_ACS_ELECHH,Percentage of households with access to electricity in main dwelling unit,Procenat domaćinstava sa pristupom električnoj energiji u glavnoj stambenoj jedinici,Проценат домаћинстава са приступом електричној енергији у главној стамбеној јединици,3,1
EN_H2O_WQBODS,Average annual values of biochemical oxygen demand in a river water (BOD5) - Sava River Basin (District) (g/m3),Prosječne godišnje vrijednosti biohemijske potrošnje kiseonika u rijekama  (BPK5)  - oblasni riječni sliv (distrikt) rijeke Save (g/m3),Просјечне годишње вриједности биохемијске потрошње кисеоника у ријекама (BPK5)  - обласни ријечни слив (дистрикт) ријеке Саве (g/m3),6,1
EN_H2O_WQBODT,Average annual values of biochemical oxygen demand in a river water (BOD5) - Trebišnjica River Basin (District) (g/m3),Prosječne godišnje vrijednosti biohemijske potrošnje kiseonika u rijekama  (BPK5)  - oblasni riječni sliv (distrikt) rijeke Trebišnjice (g/m3),Просјечне годишње вриједности биохемијске потрошње кисеоника у ријекама  (BPK5)  - обласни ријечни слив (дистрикт) ријеке Требишњице (g/m3),2,1
EN_H2O_WQNS,Average annual values of total nitrogen in a river water (total N) - Sava River Basin (District) (g/m3),Prosječne godišnje vrijednosti ukupnog azota u rijekama (ukupni N)  - oblasni riječni sliv (distrikt) rijeke Save (g/m3),Просјечне годишње вриједности укупног азота у ријекама  (укупни N) - обласни ријечни слив (дистрикт) ријеке Саве (g/m3),6,1
EN_H2O_WQNT,Average annual values of total nitrogen in a river water (total N) - Trebišnjica River Basin (District) (g/m3),Prosječne godišnje vrijednosti ukupnog azota u rijekama (ukupni N)  - oblasni riječni sliv (distrikt) rijeke Trebišnjice (g/m3),Просјечне годишње вриједности укупног азота у ријекама  (укупни N) - обласни ријечни слив (дистрикт) ријеке Требишњице (g/m3),2,1
EN_H2O_WQPS,Average annual values of total phosphorus in a river water (total P) - Sava River Basin (District) (g/m3),Prosječne godišnje vrijednosti ukupnog fosfora u rijekama (ukupni P)  - oblasni riječni sliv (distrikt) rijeke Save (g/m3),Просјечне годишње вриједности укупног фосфора у ријекама  (укупни P) - обласни ријечни слив (дистрикт) ријеке Саве (g/m3),6,1
EN_H2O_WQPT,Average annual values of total phosphorus in a river water (total P) - Trebišnjica River Basin (District) (g/m3),Prosječne godišnje vrijednosti ukupnog fosfora u rijekama (ukupni P)  - oblasni riječni sliv (distrikt) rijeke Trebišnjice (g/m3),Просјечне годишње вриједности укупног фосфора у ријекама  (укупни P) - обласни ријечни слив (дистрикт) ријеке Требишњице (g/m3),2,1
EN_LND_DWPDAMP,Households’ problems with the dwelling - damp walls/floors/foundations,"Problemi domaćinstva sa stambenom jedinicom - vlaga u podovima, zidovima, temeljima","Проблеми домаћинства са стамбеном јединицом - влага у подовима, зидовима, темељима",1,1
EN_LND_DWPDW,Households’ problems with the dwelling - rotten window frames or doors,Problemi domaćinstva sa stambenom jedinicom - truli prozorski okviri ili vrata,Проблеми домаћинства са стамбеном јединицом - трули прозорски оквири или врата,1,1
EN_LND_DWPNOISE,Households’ problems with the dwelling - noise,Problemi domaćinstva sa stambenom jedinicom - imaju probleme sa bukom,Проблеми домаћинства са стамбеном јединицом - имају проблеме са буком,1,1
EN_LND_DWPROOF,Households’ problems with the dwelling - leaking roof,Problemi domaćinstva sa stambenom jedinicom - krov prokišnjava,Проблеми домаћинства са стамбеном јединицом - кров прокишњава,1,1
EN_REF_WASDELT,Municipal waste delivered for treatment,Komunalni otpad predat na preradu,Комунални отпад предат на прераду,1,1
EN_REF_WASGENT,Total generated municipal waste,Ukupno proizvedeni komunalni otpad,Укупно произведени комунални отпад,1,1
EN_REF_WASTSHR,Share of treated municipal waste,Udio prerađenog komunalnog otpada,Удио прерађеног комуналног отпада,1,1
EN_WWT_TREATMUN,Treated municipal wastewater (thous. m3),Tretirane otpadne komunalne vode (hilj. m3),Третиране отпадне комуналне воде (хиљ. m3),1,1
EN_WWT_TREATPOP,Population connected to at least secondary wastewater treatment (%),Stanovništvo priključeno na prečistače otpadnih komunalnih voda sa najmanje sekundarnim tretmanom (%),Становништво прикључено на пречистаче отпадних комуналних вода са најмање секундарним третманом (%),1,1
ER_PTD_FRHWTREC,Freshwater ecosystems,Slatkovodni ekosistemi,Слатководни екосистеми,2,1
ER_PTD_MTNEC,Mountain ecosystems,Planinski ekosistemi,Планински екосистеми,2,1
ER_PTD_TERREC,Terrestrial ecosystems,Kopneni ekosistemi,Копнени екосистеми,2,1
ER_RSK_LSTEDS,List of endangered species,Lista ugroženih vrsta,Листа угрожених врста,7,1
FB_ATM_TOTL,b. Number of automated teller machines (ATMs),b. Broj automatizovanih bankomata (ATM),б. Број аутоматизованих банкомата (АТМ),9,1
FB_CBK_BRCH,a. Number of commercial bank branches,a. Broj filijala komercijalnih banaka,а. Број филијала комерцијалних банака,9,1
FI_FSI_FSANL,NPLs to total loans (%),NPL prema ukupnim kreditima (%),НПЛ према укупним кредитима (%),1,1
FI_FSI_FSERA,ROA (%),Povrat na aktivu (ROA) (%),Поврат на активу (РОА) (%),1,1
FI_FSI_FSERSC,ROE (%),Povrat na dionički kapital (%),Поврат на дионички капитал (%),1,1
FI_FSI_FSFCLI,Forex liabilities to total liabilities (%),Obaveze u stranoj valuti prema ukupnim obavezama (%),Обавезе у страној валути према укупним обавезама (%),1,1
FI_FSI_FSINOIRE,Non-interest expenses to gross income (%),Nekamatni rashodi prema ukupnom prihodu (%),Некаматни расходи према укупном приходу (%),1,1
FI_FSI_FSINTIRI,Net interest income to gross income (%),Neto kamatni prihod prema ukupnom prihodu (%),Нето каматни приход према укупном приходу (%),1,1
FI_FSI_FSKA,Capital to assets (%),Kapital prema aktivi (%),Капитал према активи (%),1,1
FI_FSI_FSKNL,NPLs net of provisions to Tier 1 (%),Nekvalitetni krediti umanjeni za rezervisanja prema osnovnom kapitalu (%),Неквалитетни кредити умањени за резервисања према основном капиталу (%),1,1
FI_FSI_FSKRTC,Tier 1 capital to total risk exposure amount (%),Osnovni kapital prema ukupnom iznosu izloženosti riziku (%),Основни капитал према укупном износу изложености ризику (%),1,1
FI_FSI_FSLDC,Deposits to loans (%),Depoziti prema kreditima umanjenim za međubankarske kredite (%),Депозити према кредитима умањеним за међубанкарске кредите (%),1,1
FI_FSI_FSLS,Liquid assets to short-term financial liabilities (%),Likvidna sredstva prema kratkoročnim finansijskim obavezama (%),Ликвидна средства према краткорочним финансијским обавезама (%),1,1
FI_FSI_FSLSTA,Liquid assets to total assets (%),Likvidna sredstva prema ukupnoj aktivi (%),Ликвидна средства према укупној активи (%),1,1
FI_FSI_FSNPA,NPAs to total assets (%),NPA prema ukupnoj aktivi (%),НПА према укупној активи (%),1,1
FI_FSI_FSNPALC,NPAs net of provisions to Tier 1 (%),Nekvalitetna aktiva umanjena za rezervisanja prema osnovnom kapitalu (%),Неквалитетна актива умањена за резервисања према основном капиталу (%),1,1
FI_FSI_FSRCER,Own funds to total risk exposure amount (%),Regulatorni kapital prema ukupnom iznosu izloženosti riziku (%),Регулаторни капитал према укупном износу изложености ризику (%),1,1
FI_FSI_FSSFCLN,Forex and indexed loans to total loans (%),Krediti u stranoj valuti i krediti sa valutnom klauzulom prema ukupnim kreditima (%),Кредити у страној валути и кредити са валутном клаузулом према укупним кредитима (%),1,1
FI_FSI_FSSNO,Net open position (%),Neto otvorena pozicija (%),Нето отворена позиција (%),1,1
FI_FSI_FSSTL,Short-term financial liabilities to total financial liabilities (%),Kratkoročne finansijske obaveze prema ukupnim obavezama (%),Краткорочне финансијске обавезе према укупним обавезама (%),1,1
GB_POP_SCIERD,Researchers (in full-time equivalent) per million inhabitants,Istraživači (u ekvivalentu punog radnog vremena) na milion stanovnika,Истраживачи (у еквиваленту пуног радног времена) на милион становника,1,1
GB_XPD_RSDSEC,"Gross domestic expenditure on research and development, by sector",Bruto domaći izdaci za istraživanje i razvoj prema sektorima,Бруто домаћи издаци за истраживање и развој према секторима,5,1
GB_XPD_RSDV,Research and development expenditure as a proportion of GDP (%),Učešće izdataka za istraživanje i razvoj u ukupnom BDP-u (%),Учешће издатака за истраживање и развој у укупном БДП-у (%),1,1
IS_RDP_FRGVOL,Volume of goods transport,Obim prevoza robe,Обим превоза робе,6,1
IS_RDP_PFVOL,Volume of passenger transport,Obim prevoza putnika,Обим превоза путника,6,1
IT_USE_LTMN,Percentage of individuals aged 16–74 years who used the Internet in the last three months,Procenat lica starosti 16–74 godine koja su koristila internet u posljednja tri mjeseca,Проценат лица старости 16–74 године која су користила интернет у посљедња три мјесеца,1,1
NV_IND_MANF,"Manufacturing value added as a proportion of GDP, current prices (%)","Učešće bruto dodate vrijednosti prerađivačke industrije u BDP-u, tekuće cijene (%)","Учешће бруто додате вриједности прерађивачке индустрије у БДП-у, текуће цијене (%)",1,1
NV_IND_SSIS,Proportion of small-scale industries in total industry value added,Udio malih industrija u ukupnoj dodanoj vrijednosti industrije,Удио малих индустрија у укупној додатој вриједности индустрије,1,1
SE_ADT_ACTSI,Percentage of persons aged 16–74 years who used the Internet in the last three months,Procenat lica starosti 16–74 godine koja su koristila internet u posljednja tri mjeseca,Проценат лица старости 16–74 године која су користила интернет у посљедња три мјесеца,25,1
SE_ADT_ACTSPC,Percentage of persons aged 16–74 years who used a computer in the last three months,Procenat lica starosti 16–74 godine koja su koristila računar u posljednja tri mjeseca,Проценат лица старости 16–74 године која су користила рачунар у посљедња три мјесеца,1,1
SE_ADT_EDUCTRN,Participation rate in formal and non-formal education and training,Stopa učešća u formalnom i neformalnom obrazovanju i obuci,Стопа учешћа одраслих у формалном и неформалном образовању и обуци,3,1
SE_DEV_ONTRK,"Early childhood development index - percentage of children aged 36–59 months who are developmentally on track in at least three of the following domains: literacy, numeracy, physical development, social and emotional development, and learning","Indeks ranog rasta i razvoja djece - procenat djece uzrasta 36–59 mjeseci koja su dostigla očekivani razvoj u bar tri sljedeća domena: pismenost, poznavanje brojeva, fizički razvoj, socijalno-emocionalni razvoj i učenje","Индекс раног раста и развоја дјеце - проценат дјеце узраста 36–59 мјесеци која су достигла очекивани развој у бар три сљедећа домена: писменост, познавање бројева, физички развој, социјално-емоционални развој и учење",5,1
SE_PRE_PARTN,Percentage of children aged five years participating in a preschool education and upbringing programme prior to the start of primary school,Procenat djece uzrasta pet godina obuhvaćene programom predškolskog vaspitanja i obrazovanja pred polazak u školu,Проценат дјеце узраста пет година обухваћене програмом предшколског васпитања и образовања пред полазак у школу,7,1
SG_GEN_LPARL,"Proportion of seats held by women in city/municipal assemblies, according to the results of the Local Election","Procenat žena među odbornicima skupština opština i gradova, prema rezultatima Lokalnih izbora","Проценат жена међу одборницима скупштина општина и градова, према резултатима локалних избора",1,1
SG_GEN_PARL,Proportion of seats held by women in national parliaments (% of total number of seats),Udio mjesta koje imaju žene u nacionalnim parlamentima (% od ukupnog broja mjesta),Удио мјеста које имају жене у националним парламентима (% од укупног броја мјеста),1,1
SG_GEN_PARLN,Current number of seats in national parliaments (number),Broj mjesta koje imaju žene u nacionalnim parlamentima,Број мјеста које имају жене у националним парламентима,1,1
SG_GEN_PARLNT,Number of seats in national parliaments,Trenutni broj mjesta u nacionalnim parlamentima (broj),Тренутни број мјеста у националним парламентима (број),1,1
SG_LGL_GENEQEMP,"Legal frameworks that promote, enforce and monitor gender equality (percentage of achievement, 0 - 100) - Area 3: employment and economic benefits","Pravni okviri koji promovišu, sprovode i prate ravnopravnost i zabranu diskriminacije po osnovu pola (procenat postignuća, 0-100) - Oblast 3: Zaposlenost i ekonomske koristi","Правни оквири који промовишу, спроводе и прате равноправност и забрану дискриминације по основу пола (проценат постигнућа, 0-100) - Област 3: Запосленост и економске користи",1,1
SG_LGL_GENEQLFP,"Legal frameworks that promote, enforce and monitor gender equality (percentage of achievement, 0 - 100) - Area 1: overarching legal frameworks and public life","Pravni okviri koji promovišu, sprovode i prate ravnopravnost i zabranu diskriminacije po osnovu pola (procenat postignuća, 0-100) - Oblast 1: Sveobuhvatni pravni okviri i javni život","Правни оквири који промовишу, спроводе и прате равноправност и забрану дискриминације по основу пола (проценат постигнућа, 0-100) - Област 1: Свеобухватни правни оквири и јавни живот",1,1
SG_LGL_GENEQMAR,"Legal frameworks that promote, enforce and monitor gender equality (percentage of achievement, 0 - 100) - Area 4: marriage and family","Pravni okviri koji promovišu, sprovode i prate ravnopravnost i zabranu diskriminacije po osnovu pola (procenat postignuća, 0-100) - Oblast 4: Brak i porodica","Правни оквири који промовишу, спроводе и прате равноправност и забрану дискриминације по основу пола (проценат постигнућа, 0-100) - Област 4: Брак и породица",1,1
SG_LGL_GENEQVAW,"Legal frameworks that promote, enforce and monitor gender equality (percentage of achievement, 0 - 100) - Area 2: violence against women","Pravni okviri koji promovišu, sprovode i prate ravnopravnost i zabranu diskriminacije po osnovu pola (procenat postignuća, 0-100) - Oblast 2: Nasilje nad ženama","Правни оквири који промовишу, спроводе и прате равноправност и забрану дискриминације по основу пола (проценат постигнућа, 0-100) - Област 2: Насиље над женама",1,1
SH_DTH_NCOM,"Mortality rate attributed to cardiovascular disease, cancer, diabetes or chronic respiratory disease","Stopa smrtnosti uzrokovana kardiovaskularnim bolestima, rakom, dijabetesom","Стопа смртности узрокована кардиоваскуларним болестима, раком, дијабетесом или хроничном респираторном болешћу",3,1
SH_DYN_MORT,Under-five mortality rate,Stopa smrtnosti ispod pet godina,Стопа смртности испод пет година,1,1
SH_DYN_NMRT,Neonatal mortality rate,Stopa neonatalnog mortaliteta,Стопа неонаталног морталитета,1,1
SH_FPL_MTMM,Proportion of women married or in a union of reproductive age (aged 15-49 years) who have their need for family planning satisfied with modern methods,"Procenat udatih žena ili žena u zajednici, starosti 15–49 godina, koje koriste (ili čiji partner koristi) neku od savremenih metoda kontracepcije, 2006. i 2011–2012.","Проценат удатих жена или жена у заједници, старости 15–49 година, које користе (или чији партнер користи) неку од савремених метода контрацепције, 2006. и 2011–2012.",1,1
SH_H2O_SAFE_CTAP,Percentage of households supplied with running water from the tap – common faucet up to 200 m away,"Procenat domaćinstava koja se snabdijevaju tekućom vodom iz zajedničke česme, udaljene do 200 m od kuće","Проценат домаћинстава која се снабдијевају текућом водом из заједничке чесме, удаљена до 200 m од куће",1,1
SH_H2O_SAFE_OTH,Percentage of households supplied with water from other sources,Procenat domaćinstava koja se snabdijevaju vodom iz ostalih izvora,Проценат домаћинстава која се снабдијевају водом из осталих извора,1,1
SH_H2O_SAFE_RWDW,Percentage of households with running water in the dwelling unit,Procenat domaćinstava sa tekućom vodom u stambenoj jedinici,Проценат домаћинстава са текућом водом у стамбеној јединици,1,1
SH_H2O_SAFE_SPSRS,"Percentage of households supplied with water from separate source well, faucet)","Procenat domaćinstava koja se snabdijevaju vodom iz pojedinačnog izvora (bunar, stojeća česma)","Проценат домаћинстава која се снабдијевају водом из појединачног извора (бунар, стојећа чесма)",1,1
SH_HAP_HBSAGINC,"Hepatitis B incidence (per 100,000 population)",Incidencija hepatitisa B (na 100 000 stanovnika),Инциденција хепатитиса Б (на 100 000 становника),1,1
SH_HIV_INCDA,"HIV incidence per 100,000 population",Incidencija HIV-a na 100 000 stanovnika,Инциденција ХИВ-а на 100 000 становника,1,1
SH_HIV_INCDAS,Number of registered cases of HIV infection during the year,Broj prijavljenih HIV pozitivnih u toku godine,Број пријављених ХИВ позитивних у току године,9,1
SH_PRV_SMOKA,Percentage of daily smokers among the population,Procenat svakodnevnih pušača među stanovništvom,Проценат свакодневних пушача међу становништвом,4,1
SH_PRV_SMOKC,Percentage of smokers among children aged 13–15 years,Procenat pušača među djecom starosti 13–15 godina,Проценат пушача међу дјецом старости 13–15 година,1,1
SH_SAN_SAFEHH_BATH,Proportion of households owning a bathroom with a WC in the main dwelling unit,Procenat domaćinstava koja u glavnoj stambenoj jedinici posjeduju kupatilo s WC-om,Проценат домаћинстава која у главној стамбеној јединици посједују купатило са WC-ом,3,1
SH_SAN_SAFEHH_WC,Proportion of households owning a WC in the main dwelling unit,Procenat domaćinstava koja u glavnoj stambenoj jedinici posjeduju WC,Проценат домаћинстава која у главној стамбеној јединици посједују WC,3,1
SH_STA_BRTC,Proportion of births attended by skilled health personnel,Udio poroda uz prisustvo kvalifikovanih zdravstvenih radnika,Удио порода уз присуство квалификованих здравствених радника,1,1
SH_STA_MALR,"Malaria incidence (per 1,000 population)",Incidencija malarije (na 1 000 stanovnika),Инциденција маларије (на 1 000 становника),1,1
SH_STA_MORT,Maternal mortality ratio,Stopa smrtnosti majki,Стопа смртности мајки,1,1
SH_STA_SCIDE,Suicide mortality rate,Stopa smrtnosti usljed samoubistva,Стопа смртности усљед самоубиства,3,1
SH_STA_SCIDEN,Number of deaths attributed to suicide,Broj smrtnih slučajeva samoubistvom,Број смртних случајева самоубиством,3,1
SH_STA_STNT,Proportion of children moderately or severely stunted,Udio djece umjereno ili ozbiljno zaostale u razvoju,Удио дјеце умјерено или озбиљно заостале у развоју,1,1
SH_STA_TRAF,"Death rate due to road traffic injuries, by sex (per 100,000 population)","Stopa smrtnosti zbog povreda u cestovnom saobraćaju, prema polu (na 100.000 stanovnika)","Стопа смртности због повреда у друмском саобраћају, према полу (на 100.000 становника)",1,1
SH_STA_WAST,Proportion of children moderately or severely wasted,Udio djece koja su umjereno ili ozbiljno iscrpljena,Удио дјеце која су умјерено или озбиљно исцрпљена,1,1
SH_SUD_TREATN,Number of persons who received treatment for drug abuse,Broj lica liječenih zbog zloupotrebe opojnih droga,Број лица лијечених због злоупотребе опојних дрога,1,1
SH_TBS_INCID,"Tuberculosis incidence (per 100,000 population)",Incidencija tuberkuloze (na 100.000 stanovnika),Инциденција туберкулозе (на 100.000 становника),1,1
SI_COV_SOCDC,Number of social protection beneficiaries in daily care,Broj korisnika socijalne zaštite koji ostvaruju pravo na dnevno zbrinjavanje,Број корисника социјалне заштите који остварују право на дневно збрињавање,6,1
SI_COV_SOCDL,Number of social protection beneficiaries receiving cash benefits for providing care and support to another person,Broj korisnika socijalne zaštite koji ostvaruju pravo na dodatak za pomoć i njegu drugog lica,Број корисника социјалне заштите који остварују право на додатак за помоћ и његу другог лица,6,1
